Company Name,Description,Website,LinkedIn
Loopcloud,Sample browser and marketplace by Loopmasters,https://www.loopcloud.com,https://www.linkedin.com/company/loopmasters/
ADSR Sounds,Sample marketplace and audio production tutorials,https://www.adsrsounds.com,https://www.linkedin.com/company/adsr-samples/
Avid,Pro Tools DAW and professional audio solutions,https://www.avid.com,https://www.linkedin.com/company/avid-technology/
Steinberg,Cubase and Nuendo DAW for music and post-production,https://www.steinberg.net,https://www.linkedin.com/company/steinberg/
PreSonus,Studio One DAW and recording solutions,https://www.presonus.com,https://www.linkedin.com/company/presonus/
Ableton,Ableton Live DAW for electronic music and performance,https://www.ableton.com,https://www.linkedin.com/company/ableton/
