Company Name,Description,Website,LinkedIn
iZotope,Audio repair and mastering software (Native Instruments),https://www.izotope.com,https://www.linkedin.com/company/izotope/
Native Instruments,Komplete ecosystem and software instruments,https://www.native-instruments.com,https://www.linkedin.com/company/native-instruments/
Arturia,V Collection software instruments and synthesizers,https://www.arturia.com,https://www.linkedin.com/company/arturia/
Output,Arcade subscription and creative software instruments,https://output.com,https://www.linkedin.com/company/output-sounds/
Spectrasonics,Omnisphere and flagship software instruments,https://www.spectrasonics.net,https://www.linkedin.com/company/spectrasonics/
Spitfire Audio,Orchestral and cinematic sample libraries,https://www.spitfireaudio.com,https://www.linkedin.com/company/spitfire-audio/
Splice,Sample marketplace and rent-to-own plugin platform,https://splice.com,https://www.linkedin.com/company/splice/
